{
  "$schema": "https://json-schema.org/draft/2020-12/schema",
  "$id": "https://github.com/normanogr2005/Security-Lab/security-event.schema.json",
  "title": "Security Lab Event",
  "description": "Common event format for Security-Lab integrations.",
  "type": "object",
  "required": [
    "event_id",
    "timestamp",
    "source",
    "event_type",
    "severity"
  ],
  "properties": {
    "event_id": {
      "type": "string",
      "description": "Unique identifier for the event."
    },
    "timestamp": {
      "type": "string",
      "format": "date-time"
    },
    "source": {
      "type": "string",
      "enum": [
        "netscope",
        "socforge"
      ]
    },
    "event_type": {
      "type": "string"
    },
    "severity": {
      "type": "string",
      "enum": [
        "info",
        "low",
        "medium",
        "high",
        "critical"
      ]
    },
    "source_ip": {
      "type": [
        "string",
        "null"
      ]
    },
    "destination_ip": {
      "type": [
        "string",
        "null"
      ]
    },
    "source_port": {
      "type": [
        "integer",
        "null"
      ],
      "minimum": 0,
      "maximum": 65535
    },
    "destination_port": {
      "type": [
        "integer",
        "null"
      ],
      "minimum": 0,
      "maximum": 65535
    },
    "message": {
      "type": "string"
    },
    "metadata": {
      "type": "object",
      "additionalProperties": true
    }
  },
  "additionalProperties": false
}
